H08828,Switch Disposable Vape Strawberry Watermelon,4500
H08822,Switch Disposable Vape Lychee Ice,2500
H09529,Beard Ryse Bar Apple Ice 5%,2310
H09532,Beard Ryse Bar Pineapple Orange  Tangerine Ice 5%,2287
H09531,Beard Ryse Bar Blueberry Lemonade 5%,2284
H09530,Beard Ryse Bar Blueberry Cake 5%,2280
H09533,Beard Ryse Bar Strawberry Kiwi Ice 5%,2272
H08736,Vaporesso OSMALL 1.2ohm REGULAR Pod(pack of 2),2075
H08820,Switch Disposable Vape Lemon Tart,2000
H08821,Switch Disposable Vape Lush Ice,2000
H08823,Switch Disposable Vape Orange Creamsicle,2000
H08824,Switch Disposable Vape Pina Colada ice,2000
H08825,Switch Disposable Vape Strawberry Cream,1500
H09523,Hyppe Disposables Pina Colada,1119
H08826,Switch Disposable Vape Strawberry Ice,1000
H08827,Switch Disposable Vape Strawberry Watermelon Ice,1000
H09450,HYPPE Disposables - Pineapple Soda 5%,973
H09444,Hyppe Disposables Cool Melon,970
H09453,HYPPE Disposables - Lychee Ice 5%,956
H09449,HYPPE Disposables - Peach Soda 5%,953
H09463,Hyppe Max Disposable Strawberry Banana,950
H09446,HYPPE Disposables - Lychee Soda 5%,948
H09472,Hyppe Max Disposable Banana Ice,944
H09447,HYPPE Disposables - Grape Soda 5%,921
H09436,Hyppe Disposables Blue Raz,859
H09435,Hyppe Disposables Cola Ice,834
H08776,Geekvape Aegis Replacement Cartridge (Pack of 2),800
H08777,Geekvape G Coil ST 0.6ohm (Pack of 5),800
V00024,"Vaporesso QF Strips 0.15 ohm 60-90W",800
H09458,Hyppe Ultra Disposable Lychee Soda,788
H09442,Hyppe Disposables Blueberry Ice,784
H09454,Hyppe Ultra Disposable Strawberry Banana,780
H09469,Hyppe Max Disposable Lemon Soda,773
H09465,Hyppe Max Disposable Orange Soda,766
H09470,Hyppe Max Disposable Grape Soda,760
H09455,Hyppe Ultra Disposable Peach Ice,752
H09439,Hyppe Disposables Peach ice,741
H09438,Hyppe Disposables Tropical Mix,739
H09456,Hyppe Ultra Disposable Orange Soda,734
H09459,Hyppe Ultra Disposable Lush Ice,715
H09457,Hyppe Ultra Disposable Mighty Mint,714
H09468,Hyppe Max Disposable Lush Ice,709
H09460,Hyppe Ultra Disposable Lemon Soda,696
H09462,Hyppe Ultra Disposable Cola Ice,692
H09451,Hyppe Ultra Disposable Banana Ice,691
H09461,Hyppe Ultra Disposable Grape Soda,689
H06172,Suorin Drop Cartridge Black,662
H09448,HYPPE Disposables - Lemon Soda 5%,648
H09464,Hyppe Max Disposable Peach Ice,560
H08830,Vaporesso XTRA Unipod Cartridge 1.2ohm (Pack of 2),535
H08829,Vaporesso XTRA Unipod Mesh Cartridge 0.8ohm (Pack of 2),518
H09466,Hyppe Max Disposable Mighty Mint,511
H09292,Innevape Disposable The Berg,510
H09294,Mi Pod Pro Pods 2 pk,500
H09514,Lost Vape - Ultra Boost Coil 2pk (NOT FOR SALE),500
H09471,Hyppe Max Disposable Cola Ice,492
H09441,Hyppe Disposables Lush Ice,450
H09293,Innevape Disposable The Berg  Menthol,443
J06976,Jam Monster Banana 100ml 6mg,432
H09445,Hyppe Disposables Tobacco,424
J06975,Jam Monster Banana 100ml 3mg,384
H09440,Hyppe Disposables Icy Mint,376
H08764,Freecool Ystick Disposable Vape Watermelon Ice (pack of 3),300
H08765,Freecool Ystick Disposable Vape Purple Berry (pack of 3),300
H08766,Freecool Ystick Disposable Vape Lychee Ice (pack of 3),300
H08767,Freecool Ystick Disposable Vape Mango Ice (pack of 3),300
J06978,Jam Monster Banana 30ml 48mg,294
J06977,Jam Monster Banana 30ml 24mg,274
H09589,Brillipower 50A 3100mAh 18650 - Blue(Pack of 2),249
H09437,Hyppe Disposables Frozen Mango,245
H09452,HYPPE Disposables - Strawberry Banana 5%,211
H08768,Freecool Ystick Disposable Vape Ice Mint (pack of 3),200
H08769,Freecool Ystick Disposable Vape Mango (pack of 3),200
H08770,Freecool Ystick Disposable Vape Mint (pack of 3),200
H09266,Puff Stix Disposable BAR -Banana ice,200
H09267,Puff Stix Disposable BAR -Blue Razz,200
H09268,Puff Stix Disposable BAR -Blue Razz Ice,200
H09269,Puff Stix Disposable BAR -Strawberry,200
H09270,Puff Stix Disposable BAR -Watermelon Apple,200
H09271,Puff Stix Disposable BAR -Tropical,200
H09272,Puff Stix Disposable BAR -Watermelon,200
H09274,Puff Stix Disposable Bar- Watermelon Ice,200
H09443,Hyppe Disposables Frozen Banana,193
J06983,TAKE OFF - Boston Creme 60ml Freebase 3mg,172
J06995,TAKE OFF - Peppermint Vanilla 60ml Freebase 3mg,170
J07001,TAKE OFF - Watermelon Lemonade 60ml Freebase 3mg,164
H06225,Suorin Drop Tester Tip,148
J00751,Vapetasia Milk of the Poppy 100ML - 3MG,138
H06160,MOJO Tester Tip,137
J00752,Vapetasia Milk of the Poppy 100ML - 6MG,121
H08771,Freecool Ystick Disposable Vape Tobacco (pack of 3),100
H08772,Geekvape Aegis Pod Device Kit Silver Chafer,100
H08773,Geekvape Aegis Pod Device Kit Beetle Black,100
H08774,Geekvape Aegis Pod Device Kit Gunmetal,100
H08775,Geekvape Aegis Pod Device Kit Tamamushi,100
H08811,Vaporesso VM Stick 18 Kit Rainbow,100
V00123,"Vaporesso NX CCELL Coil 1.0 7-12W",100
H08809,Vaporesso VM Stick 18 Kit Black,99
H09287,VOOPOO Drag Mini  Kit (Refresh Edition) -Rhodonite,99
J06981,TAKE OFF - Apple Strudel 60ml Freebase 6mg,99
J06996,TAKE OFF - Peppermint Vanilla 60ml Freebase 6mg,99
J07016,Reds Peach 60ml 3MG,99
J07019,Reds Peach Ice 60ml 3MG,99
H09290,VOOPOO Drag Mini  Kit (Refresh Edition) -Coral,98
J06984,TAKE OFF - Boston Creme 60ml Freebase 6mg,97
H09288,VOOPOO Drag Mini  Kit (Refresh Edition) -Phthalo,96
J07002,TAKE OFF - Watermelon Lemonade 60ml Freebase 6mg,95
H07980,Vaporesso Care Package,94
H09286,VOOPOO Drag Mini  Kit (Refresh Edition) -Prussian,94
H09283,Vopoo Drag 2 Kit Refresh Edition Dawn,93
H09284,Vopoo Drag 2 Kit Refresh Edition Puzzle,92
H09289,VOOPOO Drag Mini  Kit (Refresh Edition) -Purple,91
V00022,Vaporesso LUXE Mod Rainbow,90
V00428,Glass tube for Cascade  Baby Tank,90
H09285,Vopoo Drag 2 Kit Refresh Edition Scarlet,90
H09275,Vaporesso LUXE Mod Red,89
H09282,Vopoo Drag 2 Kit Refresh Edition Aurora,89
B000059,Eightcig MOJO Bundle (30pcs),88
J06907,Elysian Labs Wildfire 60ml 3mg Award Winning NVE NY 2019,87
H09281,Vopoo Drag 2 Refresh Edition Ink,86
J07017,Reds Peach 60ml 6MG,75
J07020,Reds Peach Ice 60ml 6MG,73
J06980,TAKE OFF - Apple Strudel 60ml Freebase 3mg,72
J06553,BLVK Unichoco 60ml 3MG,70
J06974,Jam Monster Banana 100ml 0mg,64
H02943,Smok Mag Kit Right-Handed Edition Silver/Black,57
J06026,Beard The One Strawberry 100ml 6mg,57
H01118,JUUL Pods Mango 5% Nicotine (Pack of 4),55
J06550,BLVK Uninilla 60ml 3MG,53
H01919,JUUL Pods Creme Brulee 5% Nicotine (Pack of 4),52
J01089,Lost Art The Grape White 60ml - 3mg,51
H08740,Vaporesso Swag 2 Mod Rose,50
H08741,Vaporesso Swag 2 Mod Green,50
H08742,Vaporesso Swag 2 Mod Purple,50
H08743,Vaporesso Swag 2 Mod Black,50
H08744,Vaporesso Swag 2 Mod silver,50
H08745,Vaporesso Swag 2 Mod Red,50
H08746,Vaporesso Swag 2 Mod blue,50
H08810,Vaporesso VM Stick 18 Kit Silver,50
H08812,Vaporesso VM Stick 18 Kit Blue,50
J06547,BLVK Unigrape 60ml 3MG,50
J070003,TAKE OFF - Apple Strudel Salts 30ml 30mg,50
J07021,Reds Salts Peach 30ml 30MG,50
J07022,Reds Salts Peach 30ml 50MG,50
J06972,Cronuts 60ml Toasted Coconut 3mg,50
J07023,Reds Salts Peach Ice 30ml 30MG,50
J07024,Reds Salts Peach Ice 30ml 50MG,50
H09572,Snowwolf Zephyr Kit Full Black,49
J07009,TAKE OFF - Peppermint Vanilla Salts 30ml 30mg,49
H02942,Smok Mag Kit Right-Handed Edition Black/Prism,40
J06908,Elysian Labs Wildfire 60ml 6mg Award Winning NVE NY 2019,37
H06028,PHIX Dinner Lady Lemon Tart Pods,36
J06554,BLVK Unichoco 60ml 6MG,35
J06963,Off The Records Captain Bearhemian 3mg,34
H04700,SMOK TF RTA G4 Deck Black,31
H07227,Moti Poster,27
J06966,Cronuts 60ml Shamrock 3mg,27
J01092,Lost Art Space Rocks 60ml - 3mg,25
J01098,Lost Art The Grape White 60ml MAX VG- 3mg,25
J06548,BLVK Unigrape 60ml 6MG,25
J06551,BLVK Uninilla 60ml 6MG,25
J06667,SD-ORANGE-30ml-35mg,25
J06668,SD-ORANGE-30ml-50mg,25
J06669,SD-TEAL-35mg-30ML,25
J06670,SD-TEAL-50mg-30ML,25
J06973,Cronuts 60ml Toasted Coconut 6mg,25
J07018,Reds Peach Ice 60ml 0MG,25
J07015,Reds Peach 60ml 0MG,24
B000060,Podstick Bundle,23
H07830,MOTI Display Case,22
B000070,Eightcig Promotional Gift Box,20
H06162,MOJO Tent Card,20
H08730,Smok Mico Kit Black Carbon Fiber,20
H08731,Smok Mico Kit Blue Carbon Fiber,20
H08732,Smok Mico Kit Silver Carbon Fiber,20
H08733,Smok Mico Kit 7 color Carbon Fiber,20
H08734,Smok Mico Kit White Carbon Fiber,20
V00441,Aurora Play Kit - Silver 2ml,20
J06969,Cronuts 60ml Blueberry 3mg,20
J01101,Lost Art - Slotter Pop - Ziggy 60ml - 3mg,17
J06651,Coastal Clouds 15ml sample juice,17
J06960,Off The Records Captain Fantastik 3mg,17
H07540,Uwell Yearn Pod Ice Mint 50MG (Pack of 2),16
J06967,Cronuts 60ml Shamrock 6mg,13
H06836,Skol Pods Pink Lemonade (Pack of 4),12
H06165,Mojo Flavor Card,12
J06546,BLVK Unigrape 60ml 0MG,10
J06549,BLVK Uninilla 60ml 0MG,10
J06552,BLVK Unichoco 60ml 0MG,10
J05274,Vapetasia Twin Pack Pink Lemonade 2x60ml 3MG,9
H03984,Phix Cool Grape Pods,9
H06489,INFZN Pods Mango (PHIX Compatible) (Pack of 4),9
J06964,Off The Records Captain Bearhemian 6mg,8
B000001,Eightcig MOTI Bundle (Open System),8
H07978,PUFF Krush Add-On Pre-Filled Pods Regular Flavors (Pack of 24),7
J06961,Off The Records Captain Fantastik 6mg,7
H02505,JOYETECH eVic-VTC Mini VW (Cyan),6
J06959,Off The Records Captain Fantastik 0mg,6
B000006,Eightcig MOTI Bundle (Half and Half NEW) + MOTI Display,6
J03049,Bad Drip God Nectar 120ml 3MG,5
J05273,Vapetasia Twin Pack Pink Lemonade 2x60ml 0MG,5
J05270,Vapetasia Twin Pack Blackberry Lemonade 2x60ml 0MG,4
B000002,Eightcig MOTI Bundle (Closed System),4
B000005,Eightcig MOTI Bundle (Closed System) + MOTI Display,3
H05494,SMOK Nord V1 Pod Device Kit Black White,3
J06968,Cronuts 60ml Blueberry 0mg,3
J06970,Cronuts 60ml Blueberry 6mg,3
H05278,Joyetech Runabout Ultra-Portable System Black Wood,3
J01552,Grizzly Eliquid Bear Graham 120ml - 3mg,2
J05272,Vapetasia Twin Pack Blackberry Lemonade 2x60ml 6MG,2
J06962,Off The Records Captain Bearhemian 0mg,2
B000004,Eightcig MOTI Bundle (Half & Half) + MOTI Display,2
H05489,SMOK Nord V1 Pod Device Kit Full Black,2
H03983,Phix Blue Raspberry Pods,2
H07209,SMOK NORD Pod Device Kit Carbon Fiber Black,2
J00209,Diamond Vape Butta Beer Green 120ml - 3mg,2
J01984,By The Pound 60ml Milk - 6mg,2
J05880,Vapetasia Twin Pack Pineapple Express 2x60ml 3MG,2
J05884,Vapetasia Twin Pack Killer Kustard  Strawberry 2x60ml 3MG,2
J05275,Vapetasia Twin Pack Pink Lemonade 2x60ml 6MG,2
J05271,Vapetasia Twin Pack Blackberry Lemonade 2x60ml 3MG,2
H08759,SMOK Nord Pod Device Blue Stabilizing Wood,1
J01152,Lost Art OGB Slotter Pop 60ml MAX VG-3mg,1
J01155,Lost Art Space Rocks 60ml MAX VG- 3mg,1
V00027,Vaporesso Tarot Baby Kit Silver,1
H00587,Smok Mag Kit - Black/Prism,1
H02535,Smok Alien Kit - Red,1
H06169,MOJO 60 slot Empty Display,1
H06299,SMOK Nord Pod Device Blue Black Resin,1
H07217,GeekVape Prebuilt Coils Clapton 0.9ohm (Pack of 2),1
H07218,GeekVape Prebuilt Coils Staggered Fused Clapton 0.2ohm (Pack of 2),1
H08302,SMOK Fetch Mini Pod Device Kit Acrylic Fluid Blue,1
J01644,Lost Art Mystery Flavor 60ML - 3MG,1
J01822,VGOD E-Juice Mango Mist 60mL - 0mg,1
J03002,Junky's Stash Buried Yesterday 30ml 3MG,1